{
  "model": "qwen3.6-35b-a3b", "quant": "UD-Q2_K_XL", "backend": "vulkan",
  "flags": {"ctx": 16384, "ngl": 99, "n_cpu_moe": 26, "flash_attn": true,
            "cache_type_k": "q8_0", "cache_type_v": "q8_0"},
  "notes": "provisional class fallback for unknown 8GB cards with 16GB RAM (conservative offload, vulkan as vendor-neutral backend); unverified.",
  "sources": ["https://huggingface.co/unsloth/Qwen3.6-35B-A3B-GGUF"]
}
